{
  "$schema": "https://json-schema.org/draft/2020-12/schema",
  "$id": "https://adversarial-ml-lab.local/schemas/evaluation_manifest.v1.json",
  "title": "Adversarial ML Lab evaluation dataset manifest (v1)",
  "description": "Frozen contract for an evaluation dataset manifest. Every manifest document MUST match this schema AND pass runtime validation in src.eval.contract.validate_manifest_document(). Malformed manifests are rejected fail-closed.",
  "type": "object",
  "additionalProperties": false,
  "required": [
    "manifest_version",
    "contract_id",
    "suite_name",
    "dataset_filename",
    "content_digest_sha256",
    "case_count",
    "case_ids",
    "family_counts",
    "schema_ref",
    "required_fields",
    "allowed_case_types",
    "allowed_risk_levels"
  ],
  "properties": {
    "manifest_version": {
      "type": "string",
      "description": "Version of the manifest schema this document conforms to. Must be exactly '1.0.0'.",
      "enum": ["1.0.0"]
    },
    "contract_id": {
      "type": "string",
      "description": "Immutable contract identifier for dataset manifests. Must be 'adml.evaluation.dataset.v1'.",
      "enum": ["adml.evaluation.dataset.v1"]
    },
    "suite_name": {
      "type": "string",
      "minLength": 1,
      "description": "Human-readable evaluation suite name (e.g. 'baseline', 'extended-2026-q2')."
    },
    "dataset_filename": {
      "type": "string",
      "minLength": 1,
      "description": "Filename of the dataset JSONL file this manifest governs. Used for cross-reference integrity checks."
    },
    "content_digest_sha256": {
      "type": "string",
      "pattern": "^[a-f0-9]{64}$",
      "description": "SHA-256 hex digest of the raw dataset file bytes. Any byte-level change invalidates the digest and must fail closed."
    },
    "case_count": {
      "type": "integer",
      "minimum": 1,
      "description": "Total number of evaluation cases in the dataset. Must equal the length of case_ids and sum of family_counts."
    },
    "case_ids": {
      "type": "array",
      "minItems": 1,
      "uniqueItems": true,
      "items": {
        "type": "string",
        "pattern": "^[a-z0-9_]+$",
        "minLength": 1
      },
      "description": "Ordered list of unique case identifiers. Ordering constraint: the JSONL row order MUST match this list exactly. Each id matches ^[a-z0-9_]+$."
    },
    "family_counts": {
      "type": "object",
      "minProperties": 1,
      "propertyNames": {
        "type": "string",
        "minLength": 1
      },
      "additionalProperties": {
        "type": "integer",
        "minimum": 0
      },
      "description": "Map of attack_family names to case counts. The sum of all values must equal case_count."
    },
    "packaged_resource": {
      "type": "string",
      "minLength": 1,
      "pattern": "^datasets/[A-Za-z0-9][A-Za-z0-9._-]*\\.jsonl$",
      "description": "Optional path to the resource within the installed package (e.g. 'datasets/baseline.jsonl'). Used when resolving manifests at runtime without a filesystem sibling."
    },
    "schema_ref": {
      "type": "string",
      "description": "Reference to the JSON Schema that governs individual JSONL rows. Must be 'evaluation_case.v1'.",
      "enum": ["evaluation_case.v1"]
    },
    "required_fields": {
      "type": "array",
      "minItems": 1,
      "items": {
        "type": "string",
        "minLength": 1
      },
      "description": "List of field names that every row in the dataset must contain. Enforced per-row at load time."
    },
    "allowed_case_types": {
      "type": "array",
      "minItems": 1,
      "items": {
        "type": "string",
        "enum": ["benign", "adversarial"]
      },
      "description": "Case types permitted in the dataset. The evaluation contract validates each row's case_type against this list."
    },
    "allowed_risk_levels": {
      "type": "array",
      "minItems": 1,
      "items": {
        "type": "string",
        "enum": ["low", "medium", "high", "critical"]
      },
      "description": "Risk levels permitted in the dataset. The evaluation contract validates each row's expected_risk_level against this list."
    }
  }
}
