{
  "manifest_version": "1.0.0",
  "contract_id": "adml.evaluation.dataset.v1",
  "suite_name": "baseline",
  "dataset_filename": "baseline.jsonl",
  "content_digest_sha256": "99a6515f3488f25e4ebaaf44880b42779b5671bd0045d92f793d37b475baded9",
  "case_count": 50,
  "case_ids": [
    "clean_summary_business",
    "clean_summary_technical",
    "clean_summary_policy",
    "clean_chat_support",
    "clean_chat_code",
    "clean_classify_ticket",
    "inj_hidden_html_review",
    "inj_ignore_override_review",
    "inj_hidden_marker_review",
    "inj_admin_mode_review",
    "inj_new_instructions_block",
    "inj_near_miss_benign",
    "tamper_bypass_history",
    "tamper_system_override",
    "tamper_fake_assistant",
    "tamper_ignore_history",
    "tamper_hidden_admin",
    "tamper_near_miss_benign",
    "evasion_leetspeak",
    "evasion_homoglyph",
    "evasion_zero_width",
    "evasion_spacing",
    "evasion_mixed",
    "evasion_near_miss_benign",
    "clean_chat_weather",
    "clean_chat_joke",
    "clean_summary_legal",
    "clean_classify_product",
    "clean_classify_spam",
    "clean_qa_product",
    "clean_chat_greeting",
    "inject_direct_override",
    "inject_delimiter_confuse",
    "inject_role_manipulation",
    "inject_context_window_stuff",
    "exfil_img_tag",
    "exfil_phishing_link",
    "exfil_token_leak",
    "exfil_near_miss_benign",
    "jailbreak_actor_role",
    "jailbreak_hypothetical",
    "jailbreak_base64",
    "jailbreak_near_miss_benign",
    "tamper_role_escalation",
    "tamper_multi_turn",
    "evasion_base64_prompt",
    "evasion_base64_attack",
    "rag_fact_alter",
    "rag_url_replace",
    "rag_near_miss_benign"
  ],
  "family_counts": {
    "clean": 13,
    "context_tampering": 8,
    "data_exfiltration": 4,
    "inference_evasion": 8,
    "jailbreak": 4,
    "prompt_injection": 10,
    "rag_poisoning": 3
  },
  "packaged_resource": "datasets/baseline.jsonl",
  "schema_ref": "evaluation_case.v1",
  "required_fields": [
    "case_id",
    "prompt",
    "context",
    "task_type",
    "expected_blocked",
    "case_type",
    "attack_family"
  ],
  "allowed_case_types": [
    "benign",
    "adversarial"
  ],
  "allowed_risk_levels": [
    "low",
    "medium",
    "high",
    "critical"
  ]
}
