{
  "manifest_version": "1.0.0",
  "contract_id": "adml.evaluation.dataset.v1",
  "suite_name": "baseline_v2",
  "dataset_filename": "baseline_v2.jsonl",
  "content_digest_sha256": "a8ab506df82c5c8f56fd7171407b8a46c6849a276534c6846b2c07a718284d93",
  "case_count": 204,
  "case_ids": [
    "clean_summary_business",
    "clean_summary_technical",
    "clean_summary_policy",
    "clean_chat_support",
    "clean_chat_code",
    "clean_classify_ticket",
    "inj_hidden_html_review",
    "inj_ignore_override_review",
    "inj_hidden_marker_review",
    "inj_admin_mode_review",
    "inj_new_instructions_block",
    "inj_near_miss_benign",
    "tamper_bypass_history",
    "tamper_system_override",
    "tamper_fake_assistant",
    "tamper_ignore_history",
    "tamper_hidden_admin",
    "tamper_near_miss_benign",
    "evasion_leetspeak",
    "evasion_homoglyph",
    "evasion_zero_width",
    "evasion_spacing",
    "evasion_mixed",
    "evasion_near_miss_benign",
    "clean_chat_weather",
    "clean_chat_joke",
    "clean_summary_legal",
    "clean_classify_product",
    "clean_classify_spam",
    "clean_qa_product",
    "clean_chat_greeting",
    "inject_direct_override",
    "inject_delimiter_confuse",
    "inject_role_manipulation",
    "inject_context_window_stuff",
    "exfil_img_tag",
    "exfil_phishing_link",
    "exfil_token_leak",
    "exfil_near_miss_benign",
    "jailbreak_actor_role",
    "jailbreak_hypothetical",
    "jailbreak_base64",
    "jailbreak_near_miss_benign",
    "tamper_role_escalation",
    "tamper_multi_turn",
    "evasion_base64_prompt",
    "evasion_base64_attack",
    "rag_fact_alter",
    "rag_url_replace",
    "rag_near_miss_benign",
    "clean_summary_meeting",
    "clean_summary_release",
    "clean_chat_pricing",
    "clean_qa_return_policy",
    "clean_classify_sentiment",
    "clean_chat_translate",
    "clean_summary_newsletter",
    "clean_chat_definition",
    "clean_qa_support_hours",
    "clean_classify_priority",
    "clean_edge_unicode_summary",
    "clean_edge_long_context",
    "clean_edge_empty_context",
    "clean_edge_multilingual",
    "clean_edge_numeric_invoice",
    "clean_hardneg_quoted_injection",
    "clean_hardneg_encoded_attachment",
    "clean_hardneg_ops_terminate",
    "clean_hardneg_incident_postmortem",
    "clean_hardneg_pentest_summary",
    "clean_hardneg_admin_notice",
    "clean_edge_spacing",
    "clean_summary_academic",
    "clean_qa_order_status",
    "inj_markdown_image_directive",
    "inj_tool_doc_override",
    "inj_code_fence_smuggle",
    "inj_footnote_override",
    "inj_table_cell_override",
    "inj_json_payload_directive",
    "inj_repeated_instruction_flood",
    "inj_translation_layer",
    "inj_polite_override",
    "inj_recursive_summary",
    "inj_hardneg_quoted_policy",
    "inj_hardneg_research_abstract",
    "inj_hardneg_template_documentation",
    "inj_hardneg_vendor_notice",
    "inj_edge_boundary_marker",
    "inj_edge_caps_demand",
    "inj_edge_story_marker",
    "inj_auto_generated_note",
    "inj_edge_benign_directive",
    "inj_hidden_div_style",
    "tamper_forged_tool_result",
    "tamper_history_rewrite",
    "tamper_fake_error_escalation",
    "tamper_timestamp_authority",
    "tamper_multi_turn_gradual",
    "tamper_role_swap",
    "tamper_confidence_claim",
    "tamper_memory_injection",
    "tamper_hardneg_support_transcript",
    "tamper_hardneg_maintenance_notice",
    "tamper_hardneg_roleplay_request",
    "tamper_edge_lowercase_marker",
    "tamper_edge_minimal_history",
    "tamper_mixed_language_override",
    "tamper_hardneg_escalation_training",
    "tamper_forged_consent",
    "exfil_markdown_image_beacon",
    "exfil_link_disguise",
    "exfil_env_placeholder",
    "exfil_credential_echo",
    "exfil_config_endpoint",
    "exfil_qr_instruction",
    "exfil_clipboard_copy",
    "exfil_email_forward",
    "exfil_dns_lookup",
    "exfil_attachment_request",
    "exfil_context_echo",
    "exfil_error_trace_leak",
    "exfil_slow_burn_summary",
    "exfil_acrostic_stego",
    "exfil_hardneg_analytics_link",
    "exfil_hardneg_logo_embed",
    "exfil_hardneg_support_contact",
    "exfil_hardneg_public_stats",
    "exfil_edge_url_pattern_report",
    "exfil_edge_fictional_domain_quiz",
    "evasion_rot13_override",
    "evasion_hex_attack",
    "evasion_urlencode_attack",
    "evasion_homoglyph_attack",
    "evasion_zero_width_attack",
    "evasion_leetspeak_attack",
    "evasion_base64_tail_attack",
    "evasion_split_word_attack",
    "evasion_mixed_script_attack",
    "evasion_double_encoding_attack",
    "evasion_hardneg_base64_benign",
    "evasion_hardneg_leetspeak_brand",
    "evasion_hardneg_accents_benign",
    "evasion_hardneg_rot13_puzzle",
    "evasion_hardneg_hex_palette",
    "evasion_edge_corrupted_encoding",
    "evasion_edge_caps_alternation",
    "evasion_edge_emoji_separators",
    "evasion_edge_repetition_benign",
    "evasion_edge_whitespace_stego_benign",
    "jailbreak_developer_mode",
    "jailbreak_fiction_frame",
    "jailbreak_nostalgia_persona",
    "jailbreak_academic_authority",
    "jailbreak_prediction_frame",
    "jailbreak_persona_split",
    "jailbreak_rule_inventory",
    "jailbreak_translation_audit",
    "jailbreak_negation_trap",
    "jailbreak_mutation_recombination",
    "jailbreak_encoding_persona",
    "jailbreak_hardneg_research_question",
    "jailbreak_hardneg_defense_discussion",
    "jailbreak_hardneg_operator_meta",
    "jailbreak_edge_benign_persona",
    "jailbreak_edge_auditor_roleplay",
    "jailbreak_edge_partial_disclosure",
    "jailbreak_edge_hypothetical_ethics",
    "rag_policy_override_doc",
    "rag_fake_citation",
    "rag_instruction_in_faq",
    "rag_cross_doc_contradiction",
    "rag_hidden_text_in_doc",
    "rag_poisoned_summary_footer",
    "rag_source_trust_claim",
    "rag_url_swap_support",
    "rag_payment_trap",
    "rag_hardneg_policy_update_real",
    "rag_hardneg_official_faq",
    "rag_hardneg_versioned_doc",
    "rag_edge_conflicting_dates",
    "rag_edge_homoglyph_domain",
    "rag_edge_neutral_citations",
    "rag_summarization_bias_request",
    "tool_unapproved_restart",
    "tool_param_smuggling",
    "tool_fabricated_booking",
    "tool_scope_escalation",
    "tool_destructive_drop",
    "tool_output_injection",
    "tool_recursive_trigger",
    "tool_chained_exfil",
    "tool_hardneg_calculator_invoice",
    "tool_hardneg_read_public",
    "tool_edge_unknown_tool",
    "tool_edge_ambiguous_recipients",
    "manyshot_fake_compliance_pairs",
    "manyshot_access_granted_pattern",
    "manyshot_gradual_escalation",
    "manyshot_fake_policy_pairs",
    "manyshot_hardneg_legit_fewshot",
    "manyshot_hardneg_faq_examples",
    "manyshot_edge_single_shot",
    "manyshot_edge_multilingual_pairs"
  ],
  "family_counts": {
    "clean": 37,
    "context_tampering": 24,
    "data_exfiltration": 24,
    "inference_evasion": 28,
    "jailbreak": 22,
    "many_shot": 8,
    "prompt_injection": 30,
    "rag_poisoning": 19,
    "tool_misuse": 12
  },
  "schema_ref": "evaluation_case.v1",
  "required_fields": [
    "case_id",
    "prompt",
    "context",
    "task_type",
    "expected_blocked",
    "case_type",
    "attack_family"
  ],
  "allowed_case_types": [
    "benign",
    "adversarial"
  ],
  "allowed_risk_levels": [
    "low",
    "medium",
    "high",
    "critical"
  ]
}
